{
  "version": "v0",
  "generated_at": "2026-02-23T16:00:00Z",
  "run_id": "run_weekly_ops_sync_20260223",
  "base_run_id": "run_weekly_ops_sync_20260222",
  "base_source": "auto_previous",
  "scope": {
    "workspace_id": "wsp_mindverse_cn",
    "agent_id": "agt_ops_assistant_v1",
    "playbook_id": "pbk_weekly_ops_sync"
  },
  "summary": {
    "current_status": "waiting_approval",
    "base_status": "completed",
    "partial": false,
    "totals": {
      "events": {
        "current": 1,
        "base": 2,
        "delta": -1
      },
      "audit": {
        "current": 1,
        "base": 4,
        "delta": -3
      },
      "action_intents": {
        "current": 1,
        "base": 1,
        "delta": 0
      },
      "policy_decisions": {
        "current": 1,
        "base": 1,
        "delta": 0
      }
    }
  },
  "diff": {
    "event_types": {
      "total": 1,
      "truncated": false,
      "items": [
        {
          "key": "action.executed",
          "current": 0,
          "base": 1,
          "delta": -1
        }
      ]
    },
    "audit_event_types": {
      "total": 3,
      "truncated": false,
      "items": [
        {
          "key": "run.completed",
          "current": 0,
          "base": 1,
          "delta": -1
        },
        {
          "key": "action.executed",
          "current": 0,
          "base": 1,
          "delta": -1
        },
        {
          "key": "approval.resolved",
          "current": 0,
          "base": 1,
          "delta": -1
        }
      ]
    },
    "action_capabilities": {
      "total": 0,
      "truncated": false,
      "items": []
    },
    "policy_decisions": {
      "total": 0,
      "truncated": false,
      "items": []
    },
    "policy_reason_codes": {
      "total": 0,
      "truncated": false,
      "items": []
    }
  },
  "evidence": {
    "max_items_per_stream": 2000,
    "current": {
      "events": {
        "total": 1,
        "exported": 1,
        "truncated": false
      },
      "audit": {
        "total": 1,
        "exported": 1,
        "truncated": false
      }
    },
    "base": {
      "events": {
        "total": 2,
        "exported": 2,
        "truncated": false
      },
      "audit": {
        "total": 4,
        "exported": 4,
        "truncated": false
      }
    }
  }
}
